id,vanilla_rag_output,correctness,true_answer
0,"The passages you provided all relate to the theme song of ""All That,"" but they do not contain specific information about who sings it. However, the theme song for ""All That"" was originally performed by the group TLC. If you need more detailed information or context, please let me know!",True,['TLC']
1,"Geothermal energy is used the most in the western United States, particularly in states like California, Nevada, and Oregon. California is home to the largest geothermal power plants, including The Geysers, which is the world's largest geothermal complex. Nevada also has significant geothermal resources and is known for its geothermal power generation. Other states with notable geothermal energy use include Idaho and Utah.",True,['California']
2,"The passages you provided all relate to where the movie ""Jeremiah Johnson"" was filmed, but they do not contain specific information. However, I can tell you that ""Jeremiah Johnson"" was primarily filmed in the mountains of Utah, particularly in the areas around the Wasatch Range and the Uinta Mountains. If you need more detailed information or specific locations, please let me know!",True,"['Utah', 'in nearly 100 locations across Utah , including : Mount Timpanogos , Ashley National Forest , Leeds , Snow Canyon State Park , St. George , Sundance Resort , Uinta National Forest , Wasatch - Cache National Forest , and Zion National Park']"
3,"Based on the provided passages, it appears that they all relate to the same topic: who holds the record for most platinum albums. However, the specific individual or group that holds this record is not mentioned in the passages. Therefore, I cannot provide a definitive answer to your question without additional information.",False,"['The Beatles', 'AC / DC', 'Elvis Presley']"
4,"The passages you provided all relate to the topic of when the first immigrants came to Hawaii, but they do not contain specific information. Generally, the first significant wave of immigrants to Hawaii began in the early 19th century, with the arrival of Chinese laborers in the 1850s, followed by Japanese immigrants in the 1880s. If you need more detailed information or specific dates, please provide the content of the passages.",False,"['Around 1200', 'sometime between 124 and 800 CE , with some theories dating the earliest Polynesian settlements to the 10th or even 13th century']"
5,Pearls in India are primarily found in the Arabian Sea and the Bay of Bengal.,False,['the Indian Ocean']
6,"The input that tells the computer which task to execute is commonly referred to as a ""command."" Commands are instructions given to a computer to perform specific actions or tasks.",False,"['source code', 'A computer program']"
7,"The phrase ""Beam me up, Scotty"" is a famous line from the ""Star Trek"" franchise, often associated with the character Captain James T. Kirk. It refers to the use of a transporter device that allows characters to be teleported from one location to another, typically from a planet's surface to the starship Enterprise. The phrase has become a cultural reference for the idea of instant transportation or escape. 

If you are looking for specific content or themes from the passages you mentioned, please provide more details or context, and I would be happy to help further!",False,"['phencyclidine', 'cocaine', 'a mixture of phencyclidine and cocaine']"
8,"The first movie of Harry Potter, titled ""Harry Potter and the Sorcerer's Stone"" (or ""Harry Potter and the Philosopher's Stone"" in some regions), was released on November 16, 2001.",True,"['2001', '16 November 2001']"
9,George W. Bush carried Florida by 537 votes in the 2000 presidential election.,True,"['George W. Bush', 'Bush']"
10,"The South Asian Association for Regional Cooperation (SAARC) was formed on December 8, 1985.",False,"['December 1985', '8 December 1985']"
11,The state that was returned to Spain after the Revolutionary War is Florida.,True,"['Florida', 'Menorca']"
12,"Clash Royale was released in the US on March 2, 2016.",False,"['March 2 , 2016']"
13,"The highest base on the pH scale is typically considered to be 14. This is the maximum value on the scale, which ranges from 0 to 14, with 7 being neutral. Values above 7 indicate basic (alkaline) solutions, and 14 represents the strongest bases.",False,['greater than 14']
14,"Based on the passages provided, it seems that they all relate to the deaths that occur in season 2 of ""The Originals."" However, since the specific details of those passages are not provided, I cannot give you the names of the characters who die in that season. If you can provide more specific information or details from those passages, I would be happy to help summarize or analyze that information!",False,['Kol']
15,"The phrase ""I'll gladly pay you Tuesday"" is famously associated with the character J. Wellington Wimpy from the comic strip ""Popeye.""",True,['Wimpy']
16,"Typically, a child is considered to be no longer a toddler around the age of 3. This is generally when they transition into the preschool stage. However, the exact age can vary depending on different definitions and developmental milestones.",False,['36 months']
17,"The passages you provided all relate to the same topic: the U.S. economy during the Great Depression in the 1930s. However, since the content of the passages is not specified beyond their introductory phrases, I cannot provide specific details about what the U.S. economy experienced during that time. 

Generally, during the Great Depression, the U.S. economy faced severe challenges, including widespread unemployment, bank failures, a significant decline in industrial production, and a dramatic drop in consumer spending. The stock market crash of 1929 marked the beginning of this economic downturn, leading to a decade of hardship for many Americans. 

If you have specific details or themes from the passages that you would like to discuss, please provide them, and I can help further!",False,"['an economic recession', 'economic recession', 'recession']"
18,"Día de los Muertos is celebrated throughout Mexico, with significant observances in various regions. Key locations include:

1. **Oaxaca** - Known for its vibrant celebrations and unique traditions.
2. **Mexico City** - Features large public displays and parades.
3. **Pátzcuaro** - Famous for its lakeside ceremonies and the island of Janitzio.
4. **Guadalajara** - Hosts various events and cultural activities.
5. **San Miguel de Allende** - Celebrated with colorful altars and community gatherings.

Each region may have its own distinct customs and practices, but the essence of honoring deceased loved ones remains central to the celebration across the country.",False,"['the Central and South regions', 'October 31', 'throughout Mexico , in particular the Central and South regions']"
19,"The passages provided all relate to the same topic, but they do not contain specific information. Therefore, I cannot determine who the Steelers lost to in the playoffs last year based on the passages alone. If you have additional information or context, please provide it, and I would be happy to help!",False,['New England Patriots']
20,"The French Declaration of the Rights of Man and of the Citizen was primarily authored by the Marquis de Lafayette, with significant contributions from other members of the National Assembly, including Jean-Jacques Rousseau's ideas influencing its principles.",True,"['Lafayette', 'Thomas Jefferson', 'Honoré Mirabeau', 'General Lafayette , ( sometimes with Thomas Jefferson ) and Honoré Mirabeau .', 'General Lafayette']"
21,The head of the Spanish Inquisition was Tomás de Torquemada.,True,"['Dominican Tomás de Torquemada', 'Grand Inquisitor', 'Tomás de Torquemada', 'the Spanish Dominican Tomás de Torquemada']"
22,"It seems that you are asking about the character Spyder from ""Once Upon a Time in Venice."" However, the passages you referenced do not provide specific details or context about Spyder. If you could provide more information or specify what you would like to know about Spyder, I would be happy to help!",False,['Jason Momoa']
23,"When blood leaves the pulmonary artery, it travels to the lungs. In the lungs, the blood undergoes oxygenation, where it releases carbon dioxide and absorbs oxygen. After this process, the oxygen-rich blood returns to the heart through the pulmonary veins.",True,"['lungs', 'The pulmonary vein', 'into smaller pulmonary arteries that spread throughout the lungs']"
24,"A McChicken sandwich from McDonald's typically includes a breaded chicken patty, mayonnaise, and lettuce, all served on a sesame seed bun.",True,"['a toasted wheat bun', 'a breaded chicken patty', 'shredded lettuce', 'mayonnaise', 'toasted wheat bun', 'breaded chicken patty', 'a toasted wheat bun , a breaded chicken patty , shredded lettuce , and mayonnaise']"
25,"The passages you provided all relate to who Puss in Boots grew up with, but they do not contain specific information. Therefore, based on the general knowledge of the character, Puss in Boots is often depicted as having grown up with a young man, typically referred to as ""the miller's son"" or a similar character, depending on the version of the story. In some adaptations, he is also associated with other characters from fairy tales or folklore. If you have specific details from the passages, I could provide a more tailored answer.",False,"['Humpty Alexander Dumpty', 'Humpty Dumpty', 'Kitty Softpaws', 'Humpty Alexander Dumpty , a talking egg']"
26,"The Oscar for Best Picture in 1976 was won by ""One Flew Over the Cuckoo's Nest.""",False,['Rocky']
27,"The passages you provided all relate to the ownership of the Four Seasons Hotel in Las Vegas, but they do not contain specific information. To answer your question, the Four Seasons Hotel Las Vegas is owned by the Four Seasons Hotels and Resorts, which operates the hotel in partnership with the Mandalay Bay Resort and Casino, where the hotel is located.",False,['MGM Resorts International']
28,"The song ""Our God Is an Awesome God"" was written and originally performed by Rich Mullins.",True,['Rich Mullins']
29,Aluminum wiring was commonly used in Ontario until the mid-1970s. The use of aluminum wiring in residential construction largely ceased after 1977 due to safety concerns and the introduction of stricter electrical codes.,True,['mid-1970s']
30,"The song ""Two Pints of Lager and a Packet of Crisps"" is performed by the band **Squeeze**.",False,"['Splodgenessabounds', 'Christian Henson']"
31,"The passages you provided all relate to the filming location of ""Dancing on Ice"" this year. However, since the specific details about the filming location are not included in your message, I cannot provide the exact answer. If you have the content of those passages or any specific details, please share them, and I can help you determine where ""Dancing on Ice"" is filmed this year.",False,"['RAF Bovingdon', 'a purpose - built studio at RAF Bovingdon']"
32,"The passages you provided all relate to the timing of the next Commonwealth Games, but they do not contain specific information. Therefore, I cannot provide an exact date based on the information given. However, the next Commonwealth Games are scheduled to be held in 2026 in Victoria, Australia.",False,"['2022', 'between 27 July and 7 August 2022']"
33,"The passages all relate to the same topic, but they do not provide specific names or details about who helped them recapture Mycenae. Therefore, based on the information given, I cannot identify who helped them. If you have more specific details or context from the passages, I would be happy to help further!",False,['Aegisthus']
34,"The gallbladder is situated beneath the liver in the upper right quadrant of the abdomen. It is a small, pear-shaped organ that stores bile produced by the liver, which is released into the small intestine to aid in digestion.",True,['beneath the liver']
35,"The passages all relate to the character Jill Bigelow in ""Line of Duty,"" but they do not provide specific information about who plays the character. Therefore, I cannot provide the name of the actor based on the information given. If you have any other details or context, please share!",False,['Polly Walker']
36,"The passages you provided all relate to when the World Cup of Hockey starts, but they do not contain specific information. To answer your question accurately, I would need the actual content of those passages. If you have that information, please share it, and I can help determine when the World Cup of Hockey starts.",False,['2020']
37,"The passages you provided all relate to who cooks for the President of the United States, but they do not contain specific details. Generally, the White House has a team of chefs and kitchen staff who are responsible for preparing meals for the President and their family. The Executive Chef is typically the head of this team. Additionally, the First Lady may have input on the menu and meal planning. If you need more specific information, please provide additional context or details.",False,"['White House Executive Chef', 'Cristeta Comerford', 'The White House Executive Chef']"
38,The first baseball player to be featured on a postage stamp was Honus Wagner.,False,['Jackie Robinson']
39,"In ""Once Upon a Time,"" Emma Swan is primarily in a romantic relationship with Captain Hook, also known as Killian Jones. Their relationship develops over the course of the series, showcasing various challenges and growth.",True,['Hook']
40,"The 2018 Oscar nominations were announced on January 23, 2018.",False,"['January 23 , 2018', 'Tuesday , January 23 , 2018']"
41,"It seems that all the passages you provided are related to Chris Cornell and the theme of ""she's going to change the world."" However, without specific content from those passages, I can't provide a detailed answer or analysis. If you have a specific question or need information about Chris Cornell or the theme mentioned, please provide more context or details!",False,"[""Ca n't Change Me""]"
42,"The film ""The Remains of the Day"" was primarily filmed in England, with notable locations including the stately home of Dyrham Park in Gloucestershire, which served as the exterior for Darlington Hall. Other locations included various sites in the English countryside to capture the film's period setting.",True,"['Dyrham Park', 'Powderham Castle', 'Corsham Court', 'Badminton House', 'Weston - super-Mare', 'Limpley Stoke', 'the George Inn , Norton St Philip .', 'George Inn , Norton St Philip', 'A number of English country estates']"
43,"The winner of ""So You Think You Can Dance"" Season 13 is **Lex Ishimoto**.",False,"['Kida', ""Leon `` Kida '' Burns""]"
44,"The song ""You're Welcome"" in the credits of Moana is sung by Dwayne Johnson.",True,"['Dwayne Johnson', 'Lin - Manuel Miranda', 'Jordan Fisher']"
45,"The VAT rate changed from 17.5% to 20% on January 4, 2011.",False,['4 January 2011']
46,"The song ""Only Love Can Break Your Heart"" is sung by Neil Young.",True,['Neil Young']
47,"The actor who plays Hagrid in Harry Potter is Robbie Coltrane, and he is approximately 6 feet 1 inch (185 cm) tall.",False,['6ft 1in']
48,"In 1984, the candidates running for vice president were George H.W. Bush, who was the incumbent vice president, and Geraldine Ferraro, who was the Democratic nominee.",True,"['Ferraro', 'Congresswoman Ferraro', 'Vice President George H.W. Bush', 'George H.W. Bush', ""Geraldine Anne `` Gerry '' Ferraro""]"
49,"The passages provided all relate to the current Defence Against the Dark Arts teacher, but they do not specify who that teacher is. Therefore, I cannot determine the name of the current Defence Against the Dark Arts teacher based on the information given.",False,['Amycus Carrow']
50,"The Thames River begins in the Cotswolds, specifically at a small village called Kemble, and it flows through various towns and cities before ending at the North Sea, specifically at the Thames Estuary near Southend-on-Sea.",False,"['Lighthouse Cove', 'Near Tavistock']"
51,"Based on the provided passages, it appears that all of them relate to who has the majority in the House and Senate. However, since the specific details about the current majority party in each chamber are not included in the passages, I cannot provide a definitive answer regarding who has the majority in the House and Senate at this time. For the most accurate and up-to-date information, please refer to a reliable news source or official government website.",False,['Republican']
52,"King Théoden in ""The Lord of the Rings"" was played by actor Bernard Hill.",True,['Bernard Hill']
53,"The passages you provided all relate to the airing schedule of ""Rick and Morty,"" but since they are not included in your message, I cannot provide specific details about the show's airing times. Typically, ""Rick and Morty"" airs on Adult Swim, and you can check the current schedule on their official website or through your cable provider for the most accurate information. If you have specific details from the passages, I can help summarize or clarify them!",False,['late - night']
54,"Epidemiologists attempt to explain the link between health and variables such as environmental factors, lifestyle choices, genetic predispositions, socioeconomic status, access to healthcare, and behavioral patterns. They analyze how these variables influence the incidence and distribution of diseases within populations.",False,"['disease conditions in defined populations', 'biological agents', 'stress', 'chemicals', 'alcohol', 'smoking']"
55,"The character Emma in ""Air Bud: World Pup"" is played by actress Caitlin Wachs.",False,['Brittany Paige Bouck']
56,"The ""AA"" on a license plate typically stands for ""Automobile Association,"" which is a designation used in some countries to indicate membership in an automobile club that provides services such as roadside assistance, travel information, and insurance. It can also signify a specific type of vehicle registration or classification in certain regions. The exact meaning may vary depending on the country or state in which the license plate is issued.",False,"['cars of the royal family', 'reserved for cars of the royal family']"
57,"The Phaeacians in ""The Odyssey"" live on the island of Scheria. This island is described as a prosperous and idyllic place, known for its advanced culture and skilled seafarers. The Phaeacians are characterized by their hospitality and are instrumental in helping Odysseus return to his homeland of Ithaca.",True,"['Scheria', 'Scheria ( / ˈskɛriə / ; Ancient Greek : Σχερίη or Σχερία ) -- also known as Scherie or Phaeacia']"
58,"The passages provided all relate to the same topic, which is the start date of ""Winter Big Brother."" However, since the specific start date is not mentioned in the passages, I cannot provide an exact answer. Please refer to official announcements or sources for the most accurate information regarding the start date of ""Winter Big Brother.""",False,"['February 7 , 2018', 'set to premiere on February 7 , 2018']"
59,"The Greek figure who flew too close to the sun is Icarus. He is known for his attempt to escape Crete using wings made of feathers and wax, which melted when he flew too close to the sun.",True,['Icarus']
60,"Based on the provided passages, it appears that they all relate to the same topic: who is given credit for the GNU initiative. However, since the specific content of the passages is not provided, I cannot determine who is credited for the GNU initiative. If you can provide more details or the content of the passages, I would be happy to help you identify the individual credited for the initiative.",False,['Richard Stallman']
61,"""Antigone"" was written by the ancient Greek playwright Sophocles. He was born around 497/6 BC and died in 406/5 BC.",True,"['Sophocles', 'winter 406 / 5 BC', 'c. 497 / 6 -- winter 406 / 5 BC', 'c. 497 / 6']"
62,"General Hux in ""The Last Jedi"" is played by Domhnall Gleeson.",True,['Domhnall Gleeson']
63,"The real name of Daya in ""Taarak Mehta Ka Ooltah Chashmah"" is Disha Vakani.",True,['Disha Vakani']
64,"The last time the Philadelphia Eagles were at the Super Bowl was in 2018, when they played in Super Bowl LII on February 4, 2018. They won the game against the New England Patriots.",False,"['2017 season', '2017']"
65,"The song ""I Can't Help Falling in Love with You"" was famously recorded by Elvis Presley.",True,['Elvis Presley']
66,"The Karate Kid (2010) takes place primarily in Beijing, China. The film follows the story of Dre Parker, who moves to China with his mother and learns martial arts from Mr. Han, his mentor. The setting plays a significant role in the film, showcasing various locations in Beijing and the cultural aspects of martial arts training.",True,"['Beijing , China', 'Beijing', 'China']"
67,"The movie ""Varsity Blues"" was released on January 15, 1999.",True,"['1999', 'January 15 , 1999']"
68,The winner of the fifth season of America's Got Talent was Michael Grimm.,True,"['Soul singer Michael Grimm', 'Michael Grimm']"
69,"The passages you provided all relate to who opens the Church of the Holy Sepulchre, but they do not contain specific information. Generally, the church is opened by the various Christian denominations that share custody of it, primarily the Greek Orthodox, Armenian Apostolic, and Roman Catholic churches. Each denomination has its own designated times and responsibilities for opening and closing the church. If you need more detailed information, please provide the specific content of the passages.",False,"['the Sunni Muslim family', 'the Joudeh Al - Goudia family', 'the Nusaybah family']"
70,The recipient of the first Jnanpith Award was an author who wrote in the Kannada language.,False,['Malayalam']
71,The actor who plays Ducky on NCIS is David McCallum.,True,['David McCallum']
72,The voice of Alistair in Dragon Age is provided by actor and voice artist Steve Valentine.,True,['Steve Valentine']
73,"Based on the provided passages, it seems that all of them relate to the same topic: complaints of sudden chest pain. However, the specific recommendations or actions that patients should take are not included in the excerpts you provided. 

To answer your question accurately, I would need more detailed information from the passages regarding what patients should do when experiencing sudden chest pain. Common recommendations might include seeking immediate medical attention, calling emergency services, or taking prescribed medications, but without the specific content of the passages, I cannot provide a definitive answer.",False,['Aspirin']
74,The name of the main artery that takes blood from the heart to the body is the aorta.,True,"['The aorta', 'aorta']"
75,"Season 4 of ""The Flash"" consists of 23 episodes.",True,"['23', '23 episodes', '19']"
76,"The passages all relate to the character Cruella de Vil in ""101 Dalmatians,"" but they do not specify who played the role. However, in the original animated film released in 1961, Cruella de Vil was voiced by Betty Lou Gerson. In the live-action adaptation released in 1996, the character was portrayed by Glenn Close. If you are referring to the more recent film ""Cruella"" (2021), the character was played by Emma Stone.",True,['Glenn Close']
77,The breakdown product formed when one phosphate group is removed from ATP (adenosine triphosphate) is ADP (adenosine diphosphate).,False,"['adenosine diphosphate ( ADP )', 'an inorganic phosphate , orthophosphate ( P )', 'adenosine diphosphate ( ADP ) and an inorganic phosphate , orthophosphate ( P )']"
78,"The song ""Say You Won't Let Go"" is sung by James Arthur.",True,"['James Arthur', 'British singer and songwriter James Arthur']"
79,"The powers not given to the federal government by the Constitution are reserved for the states or the people, as outlined in the Tenth Amendment.",True,['the states or the people']
80,"The passages all relate to the same topic, but they do not provide specific information about who played Solomon in ""Little House on the Prairie."" If you need the answer, it is important to note that the character of Solomon was played by actor James Cromwell in the series.",False,['Todd Bridges']
81,The king of England in 1756 was King George II.,True,['George II']
82,"Fingerprinting was first used by the police in the late 19th century. The first systematic use of fingerprints for identification purposes by law enforcement is often attributed to Sir Edward Henry in the early 1900s, although the practice began to gain traction in the 1890s.",False,"['In 1840', 'the early 20th century']"
83,"The passages provided do not contain specific information about the episode in which Marnie comes back in Geordie Shore. Therefore, I cannot provide an answer based on the content given. If you have access to more detailed information or specific episodes, I would be happy to help you with that!",False,['5']
84,"The singer on the ""Back in Black"" album is Brian Johnson. He joined AC/DC after the death of the band's previous lead singer, Bon Scott.",True,"['Brian Johnson', 'Malcolm Young', 'Cliff Williams']"
85,Real Madrid won the Champions League final in 2016.,True,['Real Madrid']
86,"The passages you provided all relate to the filming locations of the movie ""The Glass Castle."" However, since the specific details from the passages are not included, I cannot provide a direct answer. Generally, ""The Glass Castle"" was filmed in various locations, including Los Angeles, California, and other areas that represent the settings described in the memoir by Jeannette Walls. If you have specific details from the passages, I can help summarize or clarify further!",False,"['Welch , West Virginia', 'in Welch , West Virginia']"
