id,vanilla_rag_output,correctness,true_answer
231,Anant Chaturdashi is celebrated in honor of Lord Vishnu.,False,['Ganesh']
232,"The Lincoln Highway begins in New York City and ends in San Francisco, California.",False,"['Lincoln Park in San Francisco', 'Times Square in New York City', 'from Times Square in New York City west to Lincoln Park in San Francisco']"
233,"The actress who plays Baker on ""Blue Bloods"" is Lauren Patten.",False,"['Abigail Hawk', 'Abigail Hawk ( born Abigail Diane Gustafson )']"
234,"Computers became widespread in homes and schools primarily during the late 1980s and throughout the 1990s. The introduction of personal computers, along with the development of user-friendly operating systems and educational software, contributed to their increasing presence in both environments. By the mid-1990s, many households and educational institutions had adopted computers as essential tools for learning and daily activities.",True,['1980s']
235,"The first non-native settlers in what is now the United States were primarily European explorers and colonizers. The Spanish were among the earliest, establishing settlements in the 16th century, such as St. Augustine in Florida in 1565. The English followed, with Jamestown, Virginia, founded in 1607 being one of the first permanent English settlements. Other European nations, including the French and Dutch, also established colonies in North America during the 17th century.",False,"['European colonization', 'West Norse sailors']"
236,"Nana in ""Snow Dogs"" is a Siberian Husky.",False,"['a Border Collie', 'Border Collie']"
237,"The first political society started under British rule in India was the Indian National Congress, which was founded in 1885.",False,['The British Indian Association']
238,"The passages you provided all relate to the same topic, which is what happened to the actor who played Frost on ""Rizzoli & Isles."" However, since the specific details of those passages are not included in your message, I cannot provide a direct answer. 

If you could summarize or provide the key details from those passages, I would be happy to help you answer the question regarding what happened to the actor.",False,"['committed suicide', 'Lee Thompson Young']"
239,"Ancient Egypt primarily used three types of writing: hieroglyphics, hieratic, and demotic. 

1. **Hieroglyphics**: This is the most well-known form of writing, consisting of pictorial symbols used for religious texts, monumental inscriptions, and official documents.

2. **Hieratic**: This is a cursive form of hieroglyphics used mainly by priests for religious texts and administrative documents. It was quicker to write than hieroglyphics.

3. **Demotic**: This script evolved from hieratic and was used for everyday writing, including legal and commercial documents. It was more simplified and faster to write than both hieroglyphics and hieratic.

These writing systems played a crucial role in the administration, culture, and religion of ancient Egyptian society.",False,"['hieroglyphs', 'Egyptian hieroglyphs']"
240,"The theme song for ""The Man with the Golden Gun"" was sung by Lulu.",True,['Lulu']
241,"The passages provided all relate to the release date of the DLC for Rainbow Six Siege, but they do not contain specific information. To find out when the DLC comes out, you may need to refer to official announcements from Ubisoft or check gaming news sources for the latest updates.",False,['January 2018']
242,"The name of the first earthquake early warning system is ""ShakeAlert.""",False,"['1991', 'The Mexican Seismic Alert System']"
243,"The song ""Jai Ho"" is sung by A. R. Rahman, featuring the vocals of Sukhwinder Singh, Tanvi Shah, Mahalaxmi Iyer, and others. It gained widespread popularity from the movie ""Slumdog Millionaire.""",True,"['Sukhvinder Singh', 'Mahalaxmi Iyer', 'Vijay Prakash', 'Tanvi Shah']"
244,"The passages you provided all relate to the release date of ""End of the Road."" However, since the specific release date is not included in your message, I cannot provide the exact date. If you have access to the passages, you may want to check them for the relevant information. Alternatively, ""End of the Road"" by Boyz II Men was released on August 30, 1991.",False,"['1992', 'June 30 , 1992']"
245,"The all-time leading scorer in NCAA tournament history is Kareem Abdul-Jabbar, who scored a total of 564 points during his time at UCLA.",False,['Pete Maravich']
246,"Ireland gained its independence from England on December 6, 1921, when the Anglo-Irish Treaty was signed, leading to the establishment of the Irish Free State.",False,"['In 1922', '1922']"
247,National service in the UK was abolished in 1960.,True,"['31 December 1960', '1960', 'November 1960']"
248,Game of Thrones Season 7 consists of 7 episodes.,True,"['seven', '7']"
249,"The last time Michigan beat Ohio State was on November 27, 2021.",False,['2011']
250,The Pennsylvania House of Representatives consists of 203 members.,True,"['203', '203 members']"
251,"The president derives the authority to issue executive orders from the Constitution and federal laws. Specifically, Article II of the Constitution grants the president the power to ensure that laws are faithfully executed. This authority has been interpreted to include the ability to issue executive orders to manage the operations of the federal government and to direct the implementation of laws. Additionally, various statutes may provide specific authority for executive orders related to particular issues or areas of governance.",True,"['Constitution', 'rooted in Article II of the US Constitution or enacted by the congress in statutes', 'express or implied Acts of Congress that delegate to the President some degree of discretionary power ( delegated legislation )']"
252,"The passages all relate to the same topic, which is the men's curling event in the 2018 Olympics. However, none of the passages provide specific information about the winner. Based on my knowledge, the winner of the men's curling event at the 2018 Winter Olympics was Canada.",False,['United States']
253,"The baby elephant's name in ""The Jungle Book"" is Dumbo.",False,['Hathi Jr .']
254,"The song ""Tell Me Something Good"" was famously sung by Rufus and Chaka Khan.",True,['Rufus and Chaka Khan']
255,"In the early 1800s, California society was dominated by Spanish and Mexican settlers, particularly those of Spanish descent. This period was characterized by the influence of Spanish missions, land grants, and the establishment of ranchos, which were significant aspects of California's social and economic structure during that time.",True,['Spanish']
256,"The passages you provided all relate to who ordered the Forbidden City to be built, but they do not contain specific information. However, historically, the Forbidden City was ordered to be built by the Yongle Emperor of the Ming Dynasty.",False,['Zhu Di']
257,"Based on the provided passages, the most common form of megalithic architecture in Europe is not explicitly stated. However, it is implied that each passage discusses this topic. To answer your question accurately, additional specific information from the passages would be needed to identify the most common form of megalithic architecture. Common examples of megalithic structures in Europe include dolmens, menhirs, and stone circles, but without more context from the passages, a definitive answer cannot be provided.",False,"['the portal tomb', 'portal tomb']"
258,"The US dollar officially left the gold standard in 1971 when President Richard Nixon announced the suspension of the dollar's convertibility into gold, a move often referred to as the ""Nixon Shock."" This marked the end of the Bretton Woods system, which had established fixed exchange rates between currencies and gold.",False,"['1934', 'October 1976', 'August 15 , 1971']"
259,"Movies began to be produced in color in the early 20th century, with significant advancements occurring in the 1930s. The first feature-length color film was ""The Toll of the Sea,"" released in 1922, but it wasn't until the 1930s that color films became more common, with films like ""Becky Sharp"" (1935) and ""The Adventures of Robin Hood"" (1938) showcasing the technology. The widespread adoption of color in films took off after World War II, particularly with the introduction of Technicolor, which became a standard for many major productions.",False,"['introduced around 1940', '1895']"
260,"To establish criminal liability for gross negligence manslaughter, the following four requirements must typically be met:

1. **Duty of Care**: The defendant must owe a duty of care to the victim. This means that there is a legal obligation to act in a way that does not cause harm to others.

2. **Breach of Duty**: The defendant must have breached that duty of care. This involves demonstrating that the defendant's actions fell significantly below the standard of care expected, indicating a lack of reasonable care.

3. **Causation**: There must be a direct link between the breach of duty and the harm caused to the victim. The defendant's negligence must be a substantial factor in bringing about the victim's death.

4. **Gross Negligence**: The negligence must be considered gross, meaning it is so severe that it demonstrates a complete disregard for the safety of others. This is typically assessed by considering whether the defendant's conduct was a serious departure from the standard of care expected.

These elements collectively establish the framework for determining liability in cases of gross negligence manslaughter.",False,"['the defendant breached this duty', 'the defendant owed a duty to the deceased to take care', 'the breach caused the death of the deceased', ""the defendant 's negligence was gross , that is , it showed such a disregard for the life and safety of others as to amount to a crime and deserve punishment""]"
261,"The last episode of ""The Vampire Diaries"" aired on March 10, 2017.",False,"['March 10 , 2017']"
262,"The passages you provided all relate to the start date of the new season of ""The Little Couple,"" but they do not contain specific information. To find out when the new season starts, you may need to check official announcements, the show's website, or entertainment news sources for the most accurate and up-to-date information.",False,"['September 19 , 2017']"
263,"The passages you provided all relate to who starred in ""Pirates of the Caribbean,"" but they do not specify any names. However, the main stars of the ""Pirates of the Caribbean"" film series include Johnny Depp, who played Captain Jack Sparrow, Orlando Bloom, who portrayed Will Turner, and Keira Knightley, who played Elizabeth Swann.",True,"['Johnny Depp', 'Geoffrey Rush', 'Kevin McNally', 'Orlando Bloom', 'Keira Knightley', 'Jonathan Pryce', 'Jack Davenport']"
264,"The golden age of India is commonly associated with the rule of the Gupta Empire, which lasted from approximately the 4th to the 6th century CE. This period is noted for significant achievements in arts, science, literature, and philosophy.",True,"['Chandragupta I', 'Samudragupta', 'Chandragupta II', 'Gupta Empire', 'the Guptas', 'Vishnu Gupta', 'Sri - Gupta']"
265,The lead singer of Collective Soul is Ed Roland.,True,['Ed Roland']
266,"The original ""Planet of the Apes"" was filmed at various locations, primarily in California. Key filming locations included the Los Angeles area, particularly around the Malibu hills and the San Fernando Valley. Specific sites such as the Point Mugu State Park and the area around the Santa Monica Mountains were also used to create the film's distinctive landscapes.",True,"['California', 'Utah', 'Arizona', 'in northern Arizona', 'on the Fox Ranch in Malibu Creek State Park , northwest of Los Angeles', 'in a secluded cove on the far eastern end of Westward Beach , between Zuma Beach and Point Dume in Malibu', 'on a stretch of California seacoast between Malibu and Oxnard', 'Lake Powell , Glen Canyon National Recreation Area']"
267,The Teenage Mutant Ninja Turtles first appeared in comic book form in May 1984. They later became popular through an animated television series that premiered in December 1987.,True,['1984']
268,"The longest serving manager in Manchester United history is Sir Alex Ferguson. He managed the club from 1986 to 2013, making his tenure one of the most successful and enduring in football history.",True,['Sir Alex Ferguson']
269,"The passages provided all relate to who acts as the chairman of the election commission, but they do not specify the name or details of the individual. Therefore, based on the information given, I cannot provide a specific answer to who acts as the chairman of the election commission. If you have additional context or specific details from the passages, please share them for a more accurate response.",False,"['The Chief Election Commissioner', 'Chief Election Commissioner', 'Achal Kumar Jyoti']"
270,"In ""Akame ga Kill,"" several members of the Night Raid die throughout the series. Key characters who meet their end include:

1. **Leone** - She sacrifices herself in a battle against the Empire.
2. **Najenda** - Although she survives longer than many, she ultimately faces her fate.
3. **Akame** - While she survives the series, her comrades face tragic ends.
4. **Tatsumi** - He also faces a significant and emotional conclusion.
5. **Mine** - She dies during a confrontation with the Empire.

The series is known for its high stakes and the frequent deaths of main characters, which adds to the emotional weight of the story.",True,['Tatsumi']
271,"The part of Maryland that is close to Washington, D.C. is primarily Prince George's County. This area includes cities such as Hyattsville, College Park, and Greenbelt, which are all in proximity to the nation's capital. Additionally, Montgomery County, particularly areas like Bethesda and Silver Spring, is also very close to Washington, D.C.",True,"['Washington metropolitan area', 'Calvert County', 'Charles County', 'Frederick County', 'Montgomery County', ""Prince George 's County""]"
272,The name of the restaurant in Seinfeld is Monk's Café.,False,"[""Monk 's Café"", ""Monk 's""]"
273,"The last time the Seattle Seahawks won the Super Bowl was on February 2, 2014, when they defeated the Denver Broncos in Super Bowl XLVIII.",False,['2013']
274,"The first season of ""The Crown"" consists of 10 episodes.",True,['10']
275,"The original singer of ""Fool (If You Think It's Over)"" is Chris Rea.",True,"['Chris Rea', 'British singer - songwriter Chris Rea']"
276,"The individual who was executed for being an American spy during the Revolutionary War was Nathan Hale. He is famously known for his last words, ""I only regret that I have but one life to lose for my country.""",True,['Nathan Hale']
277,"The passages provided all relate to who played the twins in ""The Darling Buds of May."" However, since the specific names are not included in the passages, I cannot provide the answer based on the information given. 

In the original television series ""The Darling Buds of May,"" the twins, Petunia and Victoria, were played by actresses Anna and Emma Chambers.",False,"['Christina Giles', 'Katherine Giles', 'Katherine Giles , as Zinnia Larkin , twin sister to Petunia ( 18 episodes )', 'Christina Giles , as Petunia Larkin , twin sister to Zinnia ( 18 episodes )']"
278,Seattle Slew won the Triple Crown in 1977.,True,"['1977', 'in 1977']"
279,"The song ""How Long Has This Been Going On?"" has been performed by various artists, but it is most famously associated with jazz singer and pianist Ella Fitzgerald. Additionally, it has been covered by other artists, including Billie Holiday and more contemporary musicians. If you are looking for a specific version or artist, please provide more details!",False,['Ace']
280,The legal drinking age in the United States was changed to 21 with the passage of the National Minimum Drinking Age Act in 1984. This law required all states to raise and enforce a minimum legal drinking age of 21.,False,"['October 1986', 'By mid-1988']"
281,"The passages you provided all relate to who did the whistling in the Muppet movie, but they do not contain specific information. Therefore, I cannot determine who did the whistling based on the information given. If you have specific details from the passages or a particular name in mind, please share that for a more accurate answer.",False,"['Andrew Bird', 'musician Andrew Bird']"
282,"The process that causes the continents to drift apart is known as plate tectonics. This theory explains that the Earth's lithosphere (the rigid outer layer) is divided into several large and small tectonic plates that float on the semi-fluid asthenosphere beneath them. The movement of these plates is driven by forces such as mantle convection, slab pull, and ridge push.

As tectonic plates move, they can diverge from one another at mid-ocean ridges, where new oceanic crust is formed as magma rises to the surface. This process creates a gap between the plates, causing the continents that are situated on these plates to drift apart over geological time. Additionally, the interactions between plates at their boundaries can lead to various geological phenomena, including earthquakes and volcanic activity, further influencing the movement of continents.

In summary, the drifting of continents is primarily caused by the movement of tectonic plates due to the dynamics of the Earth's mantle.",False,['Continental drift']
283,"The phrase ""life is like a bowl of cherries"" is commonly attributed to the American humorist and writer, Jean Shepherd. It is often paraphrased from his work and has been popularized in various forms of media.",False,['Lew Brown']
284,The nuclear model of the atom was developed by Ernest Rutherford.,True,['Ernest Rutherford']
285,"In the 1991 animated film ""Beauty and the Beast,"" the character LeFou is voiced by actor Jerry Orbach.",False,"['Venezuelan voice actor Jesse Corti', 'Jesse Corti']"
286,The New Orleans Saints have won the Super Bowl twice. They won their first Super Bowl (Super Bowl XLIV) in the 2009 season and their second Super Bowl (Super Bowl LVI) in the 2020 season.,False,['1']
287,"""I Wanna Dance with Somebody (Who Loves Me)"" by Whitney Houston was written by George Merrill and Shannon Rubicam.",True,"['George Merrill', 'Shannon Rubicam', 'George Merrill and Shannon Rubicam', 'written by George Merrill and Shannon Rubicam of the band Boy Meets Girl', 'George Merrill and Shannon Rubicam of the band Boy Meets Girl']"
288,"""Goodbye, Mr. Chips"" is a sentimental and nostalgic novel that can be classified as a coming-of-age story and a character-driven narrative. It focuses on the life of Mr. Chips, a beloved schoolteacher, and explores themes of education, love, and the passage of time. The novel captures the essence of the British educational system and reflects on the impact of personal relationships and experiences over the years.",False,"['novella', 'Psychological fiction']"
289,"The creation of human beings in the Kumulipo occurs during the wā known as ""Wā Kumulipo."" This period is characterized by the emergence of various forms of life, culminating in the creation of humans. If you need more specific details or context from the passages, please provide them, and I can assist further!",False,"['the ninth wā ,', 'the ninth', 'the ninth wā', 'In the ninth wā']"
290,"The Indian myna bird is originally from the Indian subcontinent, which includes countries such as India, Pakistan, Nepal, and Bangladesh. It has also been introduced to various other regions, including parts of the Middle East, Southeast Asia, and some Pacific islands.",True,"['Asia', 'native to Asia']"
291,"Ethiopian Airlines Flight 961 was a scheduled flight from Addis Ababa, Ethiopia, to Nairobi, Kenya, that was hijacked on November 23, 1996. The hijackers, armed with knives, took control of the aircraft and demanded to be flown to Australia. During the course of the hijacking, the pilots attempted to negotiate with the hijackers, but ultimately, the situation escalated. 

The aircraft, a Boeing 767, was forced to fly for several hours before the pilots attempted to land it in the Indian Ocean near the Comoros Islands. Unfortunately, the plane crashed into the sea, resulting in the deaths of 50 of the 175 people on board. The incident is notable not only for the tragic loss of life but also for the dramatic circumstances surrounding the hijacking and the subsequent crash. 

The crash of Ethiopian Airlines Flight 961 remains one of the most infamous aviation disasters in history, highlighting the dangers of hijacking and the challenges faced by pilots in crisis situations.",False,['23 November 1996']
292,"In the UK, mobile numbers typically start with the prefix ""07."" This is followed by a series of digits that complete the mobile number.",True,['0']
293,"The fictional character whose favorite song was ""Blueberry Hill"" is mentioned in all the passages provided. However, since the passages do not specify any unique details about the characters, it is not possible to identify a specific character from the information given. Each passage refers to a different fictional character, but they all share the same favorite song.",False,['Richie Cunningham']
294,"The player who scored the most points in a single NBA game is Wilt Chamberlain, who scored 100 points on March 2, 1962.",True,['Wilt Chamberlain']
295,"The passages all relate to the same topic, but they do not provide specific information about who played John Clark Sr. on ""NYPD Blue."" Therefore, I cannot provide the name based on the passages given. However, if you are looking for the answer, John Clark Sr. was played by actor Mark Paul Gosselaar.",False,['Joe Spano']
296,"The decision to leave the EU was made during the referendum held on June 23, 2016, where a majority of voters chose to leave the European Union.",False,['23 June 2016']
297,"Based on the provided passages, it appears that all of them relate to who represents the Arizona 9th district in the House of Representatives. However, the specific name of the representative is not included in the passages you provided. To answer your question accurately, I would need to know the current representative's name, which may change over time due to elections or other factors. As of my last update, the representative for Arizona's 9th district was Greg Stanton, but please verify with a current source for the most accurate information.",False,"['Kyrsten Sinema', 'Kyrsten Sinema ( D -- Phoenix )']"
298,"Dwight's brother on ""The Office"" was played by actor Adam Jamal Craig.",False,['Thomas Middleditch']
299,"The name of the India-Pakistan border is the ""Radcliffe Line.""",False,"['International Border ( IB )', 'International Border', 'IB', 'known locally as the International Border ( IB )', 'The India and Pakistan Border', 'India and Pakistan Border', 'the International Border ( IB )']"
300,"The new movie featuring Ajay Devgn and Sonakshi Sinha appears to be a significant project, as indicated by the multiple passages dedicated to it. However, since the passages do not provide specific details about the movie's title, plot, or release date, I cannot provide further information. If you have any specific questions or need details about the film, please let me know!",False,['Action Jackson']
301,The weapon that the Grim Reaper carries is commonly known as a scythe.,True,['scythe']
302,Two fibres that are made of proteins are silk and wool.,True,"['feathers', 'silk', 'wool', 'fur', 'hair']"
303,"The passages indicate that they all relate to the 2018 Super Bowl halftime show, but they do not provide specific information about who is performing. Therefore, based on general knowledge, Justin Timberlake was the performer for the 2018 Super Bowl halftime show.",True,['Justin Timberlake']
304,"The song ""Gone, Gone, Gone (Done Moved On)"" is sung by Robert Plant and Alison Krauss.",False,['Chilliwack']
305,"The major countries involved in the Cold War were primarily the United States and the Soviet Union, along with their respective allies. The United States led the Western bloc, which included countries in Western Europe, Canada, and other nations aligned with capitalism and democracy. The Soviet Union led the Eastern bloc, which included countries in Eastern Europe and other nations aligned with communism. Other significant countries involved included China, which played a crucial role in the dynamics of the Cold War, as well as various nations in Asia, Africa, and Latin America that were influenced by or aligned with either superpower.",True,"['the Soviet Union', 'the United States', 'the United States , its NATO allies and others', 'the Soviet Union and its satellite states', 'Soviet Union and its satellite states', 'United States , its NATO allies and others']"
306,The Lord's Prayer can be found in the Bible in two main passages: Matthew 6:9-13 and Luke 11:2-4.,False,"['the Gospel of Matthew', 'the Gospel of Luke', ""Gospel of Luke when `` one of his disciples said to him , ' Lord , teach us to pray , as John taught his disciples"", 'Gospel of Matthew in the middle of the Sermon on the Mount']"
