id,vanilla_rag_output,correctness,true_answer
160,The Great Plague of London started in 1665 and ended in 1666.,True,"['1665 to 1666', '1665', '1666', 'from 1665 to 1666']"
161,"""As You Like It"" was first performed in 1599.",False,"['1603', 'uncertain , though a performance at Wilton House in 1603 has been suggested as a possibility']"
162,"The Mona Lisa was stolen from the Louvre in 1911 by Vincenzo Peruggia, an Italian handyman and painter.",True,['Vincenzo Peruggia']
163,"The passages you provided all relate to the timing of the first ice age, but they do not contain specific information. Generally, the first major ice age, known as the Huronian glaciation, is believed to have occurred around 2.4 billion years ago. If you need more detailed information or specific dates, please provide the content of the passages.",False,"['2002', 'March 15 , 2002']"
164,"The character Jack Skellington in ""The Nightmare Before Christmas"" is voiced by Chris Sarandon. Additionally, the singing voice for Jack is provided by Danny Elfman.",True,"['Chris Sarandon', 'Danny Elfman']"
165,"The song ""Diamonds and Rust"" by Joan Baez is widely believed to be about her relationship with Bob Dylan. The lyrics reflect on themes of love, nostalgia, and the passage of time, capturing the complexities of their connection.",True,['Bob Dylan']
166,"The passages all relate to the same topic, but they do not provide specific information. However, the lion in the movie ""Zookeeper"" is voiced by Kevin James.",False,['Sylvester Stallone']
167,"The song ""For What It's Worth,"" which features the lyrics ""Stop, listen, what's that sound,"" is sung by Buffalo Springfield.",True,['Buffalo Springfield']
168,"The word ""Celsius"" is derived from the name of the Swedish astronomer Anders Celsius, who developed the Celsius temperature scale in 1742. The scale is based on the freezing point of water at 0 degrees and the boiling point at 100 degrees under standard atmospheric conditions. Celsius's work contributed significantly to the field of thermometry, and his name has since been used to denote this widely adopted temperature scale.",True,"['the Swedish astronomer Anders Celsius', 'named after the Swedish astronomer Anders Celsius']"
169,"The oldest brother in ""7th Heaven"" was played by Stephen Collins.",False,['Barry Watson']
170,The Boston Red Sox won the American League East in 2017.,False,"['Houston Astros', 'The Yankees']"
171,"The passages you provided all relate to an open-source clone of Unix created in the early 1990s. This likely refers to Linux, which was developed by Linus Torvalds and released in 1991. Linux is a widely used operating system that has become a cornerstone of open-source software. If you have a specific aspect of this topic you'd like to explore further, please let me know!",True,"['GNU / Linux', 'Linux']"
172,"Arachidonic acid is primarily found in the phospholipid bilayer of cell membranes throughout the body. It is especially abundant in the brain, liver, and muscle tissues. Additionally, it can be found in various types of cells, including neurons and immune cells, where it plays a crucial role in signaling pathways and the production of eicosanoids, which are important for inflammatory responses and other physiological functions.",True,"['brain', 'muscles', 'liver']"
173,"In ""Friday the 13th: The Final Chapter,"" Jason Voorhees was played by actor Ted White.",True,['Ted White']
174,"The character Lady Talisa in ""Game of Thrones"" is played by actress Oona Chaplin.",True,"['Oona Chaplin', 'Oona Castilla Chaplin']"
175,"Dakar is located on the westernmost point of the African continent, specifically in Senegal. It is situated along the Atlantic Ocean and serves as the capital city of Senegal.",True,"['Senegal', 'on the Cap - Vert peninsula on the Atlantic coast', ""14 ° 41 ′ 34 '' N 17 ° 26 ′ 48 '' W \ufeff / \ufeff 14.69278 ° N 17.44667 ° W"", 'the westernmost city in the Old World as well as on the African mainland']"
176,"It seems you are looking for information about ""Star Wars: The Clone Wars"" Season 3, Episode 1. However, the passages provided do not contain specific details. 

In Season 3, Episode 1, titled ""Clone Cadets,"" the story focuses on the training of clone troopers at the Kamino facility. The episode highlights the challenges faced by the cadets, particularly focusing on a group of clones who struggle to work together as a team. It explores themes of camaraderie, individuality, and the importance of teamwork in the face of adversity.

If you have specific questions or need more details about the episode, feel free to ask!",True,['Clone Cadets']
177,"The river that flows through Charleston, West Virginia's capital is the Kanawha River.",True,"['Kanawha River', 'Elk', 'Kanawha', 'the Elk and Kanawha Rivers', 'the confluence of the Elk and Kanawha Rivers']"
178,A political action committee (PAC) is an organization that collects and distributes funds to support political candidates or parties. The primary function of a PAC is to raise money from its members and then contribute to the campaigns of candidates who align with its interests or goals. PACs can also engage in advocacy efforts to influence legislation and public policy. They play a significant role in the political process by facilitating financial support for candidates and promoting specific issues or agendas.,False,"['pools campaign contributions from members', 'pools campaign contributions from members and donates those funds to campaign for or against candidates , ballot initiatives , or legislation', 'donates those funds to campaign for or against candidates , ballot initiatives , or legislation']"
179,"The largest bill in American money that was ever issued for public circulation is the $100,000 bill, which featured a portrait of Woodrow Wilson. However, it was never circulated for general use and was primarily used for transactions between Federal Reserve Banks. The largest bill that was actually circulated to the public was the $10,000 bill, which featured a portrait of Salmon P. Chase. Both of these bills are no longer in production and are considered collector's items today.",True,['$100']
180,"The first woman to win ""Who Wants to Be a Millionaire"" was Judith Keppel.",False,['Judith Cynthia Aline Keppel']
181,"The character Violet Baudelaire in the Netflix series ""A Series of Unfortunate Events"" was played by Malina Weissman.",True,['Malina Weissman']
182,"The passages all relate to who plays at the Prudential Center in Newark, but they do not provide specific details. Generally, the Prudential Center is home to the New Jersey Devils of the National Hockey League (NHL) and also hosts various concerts, events, and other sports teams. If you need more specific information, please provide additional context or details!",True,"['New Jersey Devils', 'Seton Hall Pirates', ""Seton Hall Pirates men 's basketball"", ""Seton Hall Pirates men 's basketball team from Seton Hall University"", 'New Jersey Devils of the National Hockey League ( NHL )']"
183,"The passages all relate to the construction of the Qutub Minar in Delhi, but they do not provide specific information about who caused it to be built. However, historically, the Qutub Minar was commissioned by Qutb al-Din Aibak, the founder of the Delhi Sultanate, in the 12th century.",False,"['Firoz Shah Tughlaq', 'Iltutmish', 'Qutab - ud - din Aibak', ""Aibak 's successor and son - in - law Iltutmish"", 'Qutub - ud - din Aibak', 'Qutab Ud - Din - Aibak']"
184,"The passages you provided all relate to the 2018 football hall of fame, but they do not specify the names of the individuals who were selected. Therefore, I cannot provide the names based on the information given. If you have specific names or details from those passages, please share them, and I can help further!",False,"['Terrell Owens', 'Brian Urlacher', 'Bobby Beathard', 'Brian Dawkins', 'Jerry Kramer', 'Randy Moss', 'Robert Brazile', 'Ray Lewis']"
185,The original Wonder Woman on TV was played by Lynda Carter.,True,['Lynda Carter']
186,"Based on the passages provided, computer-based models of real-life situations are called ""simulations.""",False,"['Computer simulations', 'Computer simulation']"
187,"The passages all relate to the winner of the national championship in volleyball in 2017, but they do not provide specific information about who that winner was. Therefore, I cannot answer the question based on the provided passages.",False,['Ohio State']
188,"The passages you provided all relate to the topic of who came up with popcorn at the movies, but they do not contain specific information. Based on general knowledge, popcorn became popular in movie theaters during the Great Depression, largely due to its low cost and the efforts of vendors who sold it outside theaters. One key figure often credited with popularizing popcorn in cinemas is Charles Cretors, who invented the first commercial popcorn machine in the late 19th century. However, the widespread adoption of popcorn in theaters was a collective effort by many vendors and theater owners.",False,['Glen W. Dickson']
189,"""The Grapes of Wrath"" primarily takes place during the Great Depression, focusing on the journey of the Joad family as they travel from Oklahoma to California. The story highlights the struggles of migrant workers and the harsh realities they face in search of a better life. Key locations include the Dust Bowl region of Oklahoma and various locations in California, particularly the agricultural areas where the Joads seek work.",True,"['Oklahoma', 'California']"
190,The United States shared the Oregon Country with Great Britain.,False,"['British', 'French Canadian']"
191,"The corporate tax rate in Great Britain is currently set at 25%. However, for smaller companies with profits of £50,000 or less, the rate is 19%. There are also provisions for companies with profits between £50,000 and £250,000, which are subject to a tapered rate. Please check the latest updates or official sources for any changes or specific details.",False,"['20 %', 'a flat rate of 20 %']"
192,"The Rational Dress Society began its work in the late 19th century, specifically in 1856.",False,['1881']
193,"The song ""You Are a Magnet and I Am Steel"" is performed by the band **The Magnetic Fields**.",False,['Walter Egan']
194,"""Suite: Judy Blue Eyes"" was written about Judy Collins, a folk singer and songwriter. The song was composed by Stephen Stills and reflects his feelings for her during their relationship in the late 1960s.",True,"['singer / songwriter Judy Collins', 'Judy Collins', ""Stephen Stills ' former girlfriend , singer / songwriter Judy Collins""]"
195,"The passages provided all relate to when season 8 of ""Blue Bloods"" starts, but they do not contain specific information. However, based on general knowledge, season 8 of ""Blue Bloods"" premiered on September 29, 2017. If you need more detailed information or specifics from the passages, please provide the content of those passages.",False,"['September 29 , 2017']"
196,"Based on the passages provided, it appears that they all relate to the number of seasons of ""Prison Break"" available on Netflix. However, since the specific number is not mentioned in the passages, I cannot provide an exact answer. 

As of my last update, ""Prison Break"" has five seasons. Please check Netflix directly for the most current availability.",True,['five']
197,"The passages provided all relate to the same topic, but they do not contain specific information or numbers regarding how many games in a row the UConn women's basketball team has won. Therefore, I cannot provide an answer to your question based on the information given. If you have specific data or a source that mentions the number of consecutive wins, please share that for a more accurate response.",False,"['111', '90', '111 straight wins']"
198,"The Chaplet of Divine Mercy can be prayed at any time, but it is particularly recommended to be prayed:

1. **At 3 PM** - This hour is known as the Hour of Great Mercy, commemorating the time of Jesus' death.
2. **During the Novena** - It is traditionally prayed during the Divine Mercy Novena, which begins on Good Friday and ends on the Sunday after Easter.
3. **In times of need** - It can be prayed whenever one is in need of mercy, healing, or comfort.
4. **As a form of intercession** - It can also be prayed for the souls in purgatory or for the conversion of sinners.

Overall, the Chaplet can be integrated into daily prayer life and is encouraged to be prayed regularly.",True,"['Good Friday', 'at any time , but it is said especially on Divine Mercy Sunday and Fridays at 3 : 00 PM', 'at the hour of death or in the presence of the dying']"
199,"Linkin Park released ""One More Light"" on May 19, 2017.",False,"['May 19 , 2017']"
200,"Fusing the spine refers to a surgical procedure aimed at joining two or more vertebrae together to eliminate movement between them. This is typically done to alleviate pain, stabilize the spine, or correct deformities. The process involves using bone grafts, metal rods, screws, or other devices to hold the vertebrae in place while they heal and grow together. The goal of spinal fusion is to provide stability and support to the spine, which can help improve function and reduce discomfort for individuals suffering from various spinal conditions.",False,"['joins two or more vertebrae', 'a neurosurgical or orthopedic surgical technique that joins two or more vertebrae']"
201,"The alliance between Great Britain, Russia, and France is known as the Triple Entente.",True,['The Triple Entente']
202,"Jaffa Cakes are often the subject of debate regarding whether they are classified as a biscuit or a cake. The distinction can depend on various factors, including their texture, ingredients, and legal definitions. 

In the UK, a notable case in 1991 determined that Jaffa Cakes are classified as cakes for tax purposes, specifically because they are soft and spongy like cakes, and they harden when they go stale, which is characteristic of cakes rather than biscuits. 

However, in everyday usage, many people treat them like biscuits, as they are often eaten as a snack and are found in the biscuit aisle of stores. 

In summary, while Jaffa Cakes are legally classified as cakes, they are commonly consumed and perceived as biscuits.",True,"['cakes', 'Cake', 'biscuit - sized cakes', 'the Jaffa cake should be considered a cake for tax purposes']"
203,"The passages provided all relate to the new season of ""Chicago PD,"" but they do not contain specific information about the premiere date. To find out when the new season is airing, you may want to check official sources such as the show's network, NBC, or entertainment news websites for the latest updates.",False,"['September 27 , 2017', 'September 27 , 2017 ( 2017 - 09 - 27 ) -- present']"
204,"The SA node (sinoatrial node) begins electrical signaling at the start of each heartbeat, typically around the time of the embryonic development of the heart, which is approximately in the early stages of gestation. The SA node is responsible for initiating the electrical impulses that regulate the heart's rhythm. If you need more specific details or context, please provide additional information or clarify your question!",False,"['spontaneously', 'spontaneously generated']"
205,"The middle cranial fossa primarily houses the temporal lobes of the brain, as well as parts of the frontal and parietal lobes. It also contains important structures such as the pituitary gland and various cranial nerves.",True,"['the temporal lobes', 'temporal lobes', 'pituitary gland', 'the pituitary gland']"
206,"The ""Fishin' in the Dark"" album by the Nitty Gritty Dirt Band is a notable work that features a blend of country and folk music. The title track, ""Fishin' in the Dark,"" is particularly well-known and has become a classic in the genre. The album showcases the band's signature sound, characterized by harmonious vocals and a mix of acoustic instruments. It reflects themes of love, nature, and the simple pleasures of life, often evoking a sense of nostalgia and connection to the outdoors. If you have specific aspects of the album you'd like to explore further, please let me know!",False,['Hold On']
207,"The UN Declaration of Human Rights was primarily drafted by Eleanor Roosevelt, who served as the chair of the drafting committee. Other key figures involved in the drafting process included René Cassin, who is often credited with the initial draft, and representatives from various countries who contributed to the discussions and revisions.",True,"['Charles Habib Malik , Lebanon', 'William Roy Hodgson , Australia', 'Hernán Santa Cruz , Chile', 'René Cassin , France', 'Charles Dukes , United Kingdom', 'John Peters Humphrey , Canada', 'Eleanor Roosevelt', 'Peng Chun Chang', 'Charles Habib Malik', 'William Roy Hodgson', 'Hernán Santa Cruz', 'René Cassin', 'Alexander E. Bogomolov', 'Charles Dukes', 'John Peters Humphrey', 'Eleanor Roosevelt , United States ( Chair )', 'Peng Chun Chang , Republic of China', 'Alexander E. Bogomolov , Soviet Union']"
208,"The theme song to ""Step by Step"" was sung by the group New Kids on the Block.",False,"['Jesse Frederick James Conaway', 'Jesse Frederick', 'Frederick in a duet with Teresa James']"
209,"The borders of Africa's countries were primarily created during the colonial period by European powers. The Berlin Conference of 1884-1885 is often cited as a significant event where European nations divided the continent among themselves without regard for the existing ethnic, cultural, or political boundaries. This arbitrary division has had lasting impacts on the continent's political and social landscape.",False,['European imperial powers']
210,A Terry's Chocolate Orange typically contains 20 segments.,True,"['20', 'six']"
211,Acid rain.,True,"['Acid rain', ""`` Acid rain ''""]"
212,"The passages provided all relate to the location of the last scene of ""The Danish Girl,"" but they do not contain specific information. Therefore, I cannot provide a definitive answer based on the content given. However, if you have any additional details or context, I would be happy to help!",False,"['the Mount Mannen in Norway', 'the Isle of Sheppey in England']"
213,"The main stars of the movie ""Natural Born Killers"" are Woody Harrelson and Juliette Lewis.",True,"['Woody Harrelson', 'Juliette Lewis', 'Robert Downey , Jr .', 'Tommy Lee Jones', 'Tom Sizemore', 'Robert Downey Jr.']"
214,"The final season of ""Downton Abbey"" is the sixth season. It aired in the UK from September 2015 to November 2015 and concluded the storylines of the beloved characters in the series.",True,"['six', 'the sixth', 'the sixth series', 'sixth', 'Six']"
215,"The boundary line between India and Bangladesh is known as the ""Radcliffe Line.""",False,"['International Border ( IB )', 'the International Border ( IB )']"
216,"The passages provided all relate to where the ""This Is Us"" family lives, but they do not contain specific information. Based on general knowledge, the ""This Is Us"" family, the Pearsons, primarily reside in Pittsburgh, Pennsylvania.",True,['Pittsburgh']
217,Mission Nuestra Señora de la Soledad was founded by Father Fermín Lasuén in 1791.,False,"['the Franciscan order', 'Fermín Francisco de Lasuén']"
218,"To play Mexican Train, you typically need a set of double-12 dominoes, which consists of 91 dominoes. This set is suitable for 2 to 8 players. If you have fewer players, you can still use the same set, but the number of dominoes drawn at the beginning of the game may vary. For larger groups, you might consider using a double-15 set, which has 136 dominoes.",False,['A double - twelve set']
219,"The passages you provided all relate to when Fender started making amps in Mexico, but they do not contain specific information. If you have access to the content of those passages, please share it, and I can help you extract the relevant information. Otherwise, based on general knowledge, Fender began producing amplifiers in Mexico in the early 1990s.",False,['1996']
220,"The passages provided all relate to the topic of who has won the most United States championships, but they do not contain specific information. Therefore, I cannot determine who has won the most United States championships based on the passages alone. If you have specific details or data from those passages, please share them, and I can help you analyze that information.",False,"['Ric Flair', 'Lex Luger']"
221,"Doug and Julie are iconic characters from the soap opera ""Days of Our Lives."" They have been part of the show for many years and are known for their enduring love story, which has captivated audiences. Doug Williams, portrayed by Bill Hayes, and Julie Olson, played by Susan Seaforth Hayes, have experienced numerous ups and downs throughout their time on the show, including romantic entanglements, family drama, and personal challenges. Their relationship is a central theme in many storylines, showcasing themes of love, loyalty, and resilience.",True,"['Bill Hayes', 'Susan Seaforth Hayes', 'Susan Seaforth', 'Doug is portrayed by Bill Hayes', 'Julie is portrayed by Susan Seaforth Hayes']"
222,"In the Bible, the pearl symbolizes various spiritual truths and values. It is often associated with purity, wisdom, and the Kingdom of Heaven. For example, in Matthew 13:45-46, Jesus compares the Kingdom of Heaven to a merchant seeking fine pearls, highlighting the immense value and worth of spiritual treasures. Pearls also represent the idea of something precious and rare, suggesting that true wisdom and the teachings of Christ are invaluable. Additionally, the pearl can symbolize the transformation and beauty that can arise from trials and suffering, as pearls are formed through the irritation of a grain of sand within an oyster. Overall, the pearl serves as a powerful metaphor for the pursuit of spiritual enlightenment and the treasures found in faith.",True,['the Kingdom of Heaven']
223,"Lynyrd Skynyrd's plane crash happened on October 20, 1977.",False,"['October 20 , 1977']"
224,"Fungi play a crucial role in food webs as decomposers. They break down organic matter, such as dead plants and animals, returning essential nutrients to the soil and making them available for producers like plants. This process helps sustain the ecosystem by recycling nutrients and supporting the growth of primary producers, which are at the base of the food web. Additionally, some fungi form symbiotic relationships with plants (mycorrhizae), enhancing nutrient uptake for the plants while receiving carbohydrates in return. Thus, fungi occupy a vital position in food webs, primarily as decomposers and in mutualistic relationships with producers.",True,"['the end', 'At the end', 'decomposers', 'At the end of the food chain']"
225,"The main stars of ""An Officer and a Gentleman"" are Richard Gere, Debra Winger, and Louis Gossett Jr.",True,"['Richard Gere', 'Debra Winger', 'David Keith', 'Louis Gossett Jr .', 'Louis Gossett Jr.', 'Phillip J. Salmon']"
226,The first Nobel Prize in Physics was awarded to Wilhelm Röntgen in 1901 for the discovery of X-rays.,False,"['Wilhelm Conrad Röntgen', 'Wilhelm Conrad Röntgen , of Germany']"
227,"The powers of the Supreme Court in the Philippines include the following:

1. **Judicial Review**: The Supreme Court has the authority to review and nullify laws, executive orders, and other government actions that are deemed unconstitutional.

2. **Final Arbiter of Legal Disputes**: It serves as the highest court of appeal in the country, resolving disputes and interpreting laws.

3. **Protection of Fundamental Rights**: The Court has the power to protect individual rights and liberties, ensuring that laws and government actions do not violate constitutional provisions.

4. **Administrative Supervision**: The Supreme Court oversees the lower courts and has the authority to discipline judges and court personnel.

5. **Advisory Role**: It can provide advisory opinions on legal questions referred to it by the President or other government officials, although this is not a common practice.

6. **Original Jurisdiction**: The Supreme Court has original jurisdiction over certain cases, such as those involving ambassadors, public ministers, and consuls, as well as cases affecting the constitutionality of laws.

These powers enable the Supreme Court to uphold the rule of law and maintain the balance of power within the government.",False,"['Justices', 'administrative supervision over all courts and the personnel thereof', ""`` administrative supervision over all courts and the personnel thereof ''""]"
228,"The Duluth Model is an intervention program that emphasizes the importance of addressing power and control dynamics in relationships, particularly in cases of domestic violence. It focuses on educating offenders about the impact of their behavior, promoting accountability, and fostering non-violent relationships. The program aims to change attitudes and behaviors that contribute to violence, emphasizing the need for respect and equality in interpersonal relationships.",False,['re-education']
229,"The name ""Loyola University"" comes from Saint Ignatius of Loyola, the founder of the Society of Jesus (Jesuits). The university is named in honor of him, reflecting its Jesuit heritage and commitment to education, social justice, and service. The name is associated with various institutions around the world that share this Jesuit tradition.",False,['St. Ignatius of Loyola']
230,"Primary ossification centers typically appear in an embryo around the 7th to 12th week of gestation. This process marks the beginning of bone development, where cartilage models of the bones begin to be replaced by bone tissue.",False,['prenatal development']
