id,vanilla_rag_output,correctness,true_answer
307,"In ""Gotham by Gaslight,"" Jack the Ripper is portrayed as a mysterious and menacing figure who has come to Gotham City, creating a sense of fear and intrigue. The story reimagines the infamous serial killer from Victorian London, placing him in the context of Gotham's dark and gritty atmosphere. The narrative typically involves Batman investigating the murders attributed to Jack the Ripper, blending elements of horror and detective fiction. The identity of Jack the Ripper in this adaptation may involve twists and connections to other characters in the Batman universe, adding depth to the storyline.",False,['Jacob Packer']
308,"The film ""Walk the Line"" starred Joaquin Phoenix as Johnny Cash and Reese Witherspoon as June Carter Cash.",True,"['Joaquin Phoenix', 'Reese Witherspoon', 'Ginnifer Goodwin', 'Robert Patrick', 'Dallas Roberts', ""Joaquin Phoenix as Cash , Reese Witherspoon as Carter , Ginnifer Goodwin as Vivian Liberto , and Robert Patrick as Cash 's father""]"
309,"""Harry Potter and the Philosopher's Stone"" was published on June 26, 1997.",True,"['1997', 'in 1997']"
310,"The passages all relate to who plays David in ""Alvin and the Chipmunks,"" but they do not provide specific information. However, in the ""Alvin and the Chipmunks"" film series, the character David Seville is portrayed by actor Jason Lee.",True,['Jason Lee']
311,"The word that means separation of church and state is ""secularism.""",False,['separationism']
312,"The passages you provided all relate to the release date of the movie ""The Star."" However, since the content of the passages is not specified, I cannot provide a specific release date. If you have a particular date in mind or if you can provide more details from the passages, I would be happy to help!",False,"['November 17 , 2017']"
313,"The passages you provided all relate to who played the first NFL Thursday Night Football game, but they do not contain specific information. However, the first NFL Thursday Night Football game was played on November 13, 2006, between the Denver Broncos and the New York Jets.",True,"['Kansas City Chiefs', 'Denver Broncos', 'the Kansas City Chiefs', 'the visiting Denver Broncos']"
314,"Social Security numbers began being assigned at birth in 2011. Prior to that, they were typically assigned later in childhood or adulthood.",False,['1990']
315,"The passages provided all relate to the return of ""Love and Hip Hop: New York,"" but they do not contain specific information about the date or time of its return. To find out when the show comes back on, you may need to check the official network schedule or the show's social media pages for the latest updates.",False,"['October 30 , 2017', 'November 13 , 2017']"
316,"The passages you provided all relate to the same topic, but they do not contain specific information about who played Amy Grant in ""I Can Only Imagine."" However, the actress who portrayed Amy Grant in the film is **Brooke Stokes**.",False,['Nicole DuPort']
317,"The passages you provided all relate to the percentage of the US population that lives below the poverty line, but they do not contain specific data or figures. To answer your question accurately, I would need the actual statistics from those passages. However, as of my last knowledge update in October 2023, the percentage of the US population living below the poverty line was approximately 11-12%. For the most current and precise figure, I recommend checking the latest data from the U.S. Census Bureau or other reliable sources.",False,"['In 2015 , 13.5 %', '13.5 %', 'In 2015 , 13.5 % ( 43.1 million )', '13.5 % ( 43.1 million )']"
318,"Based on the provided passages, it appears that they all relate to the president of the Republic of Zambia. However, the specific name of the current president is not mentioned in the passages. As of my last knowledge update in October 2023, the president of Zambia is Hakainde Hichilema, who took office on August 24, 2021. Please verify with up-to-date sources, as political positions can change.",False,['Edgar Lungu']
319,"South by Southwest (SXSW) typically starts in Austin, Texas, in mid-March each year. For the exact dates, it's best to check the official SXSW website or announcements, as they can vary slightly from year to year.",True,"['mid-March', '2018 ran from March 9 to 18', 'March 8 -- 17 , 2019']"
320,Real Madrid has won the UEFA Champions League (formerly known as the European Cup) three times in a row. They achieved this feat from 2016 to 2018.,False,"['five', 'five times']"
321,"The passages you provided all relate to the same topic: the beginning of the study of media effects. However, since the specific content of the passages is not included, I cannot provide a definitive answer based on the passages themselves. 

Generally, the study of media effects began in the early 20th century, particularly with the rise of mass media such as radio and film. Key studies, such as the Payne Fund Studies in the 1930s, explored the impact of media on audiences, particularly children. If you have specific details or excerpts from the passages, I would be happy to help analyze them further!",False,"['1919', '1975']"
322,"The host of the 2018 Winter Olympics is Pyeongchang, South Korea.",True,"['South Korea', 'Pyeongchang County , South Korea']"
323,"The Battle of Britain Flight is based at the Royal Air Force (RAF) base in Duxford, Cambridgeshire, England.",False,['RAF Coningsby in Lincolnshire']
324,The 2018 FIFA World Cup was held in Russia.,True,['Russia']
325,"The passages you provided all relate to the release schedule of ""The Walking Dead"" comics. However, since the specific details about the release dates are not included in your message, I cannot provide an exact answer. Generally, ""The Walking Dead"" comics were released monthly, but for precise dates or any changes in the schedule, you would need to refer to the specific passages or additional sources.",False,"['2003', 'October 2003 -- present']"
326,"The passages you provided all relate to when the 5th round of the FA Cup is played, but they do not contain specific dates or details. Typically, the 5th round of the FA Cup is held in February, but for the exact date, you would need to refer to the official FA Cup schedule for the current season.",False,"['February 2018', '29 January 2018', '16 February 2018']"
327,"The passages provided all relate to the start date of the new series of ""Keeping Faith,"" but they do not contain specific information about the date itself. Therefore, I cannot provide an answer to your question based on the given passages. If you have access to additional information or specific details from those passages, please share them, and I would be happy to help!",False,['13 February 2018']
328,"A heart rate of 131 beats per minute (bpm) typically indicates that the heart is beating faster than the normal resting rate, which is usually between 60 to 100 bpm for adults. This elevated heart rate can be a result of various factors, including physical activity, stress, anxiety, or medical conditions. 

In a healthy individual, a heart rate of 131 bpm during exercise or physical exertion is generally considered normal and can reflect the body's response to increased demand for oxygen. However, if this heart rate occurs at rest or with minimal exertion, it may warrant further investigation to rule out underlying health issues such as dehydration, fever, or heart-related conditions.

It's important to consider the context in which the heart rate is measured, including the individual's overall health, fitness level, and any symptoms they may be experiencing. If there are concerns about a consistently high heart rate, consulting a healthcare professional is advisable for a thorough evaluation.",False,"['tachycardia in adults', 'Tachycardia']"
329,"The passages you provided all relate to the same topic, but they do not contain specific information. However, I can tell you that in the movie ""Sing,"" the voice of the elephant, Meena, is performed by actress and singer Tori Kelly.",True,['Tori Kelly']
330,"The words ""under God"" were added to the Pledge of Allegiance in 1954.",True,"['on Flag Day in 1954', '1954', 'Flag Day in 1954']"
331,"DNA can be found in several locations within the body, primarily in the following areas:

1. **Nucleus of Cells**: The majority of DNA is located in the cell nucleus, where it is organized into chromosomes. This is where the genetic material is stored and replicated.

2. **Mitochondria**: Mitochondrial DNA (mtDNA) is found in the mitochondria, the energy-producing organelles in cells. This DNA is inherited maternally and is distinct from nuclear DNA.

3. **Blood**: DNA can also be found in blood cells, particularly in white blood cells, which contain a nucleus. Red blood cells, however, do not contain DNA as they lack a nucleus.

4. **Saliva**: Saliva contains cells that have DNA, which can be extracted for various purposes, including genetic testing.

5. **Hair Follicles**: DNA can be found in the root of hair follicles, which can be used for forensic analysis.

6. **Skin Cells**: Skin cells shed continuously and contain DNA, which can be collected for various analyses.

7. **Other Body Tissues**: DNA is present in nearly all tissues of the body, including organs, muscles, and connective tissues, as long as there are nucleated cells.

In summary, DNA is primarily found in the nucleus of cells, but it is also present in mitochondria, blood, saliva, hair follicles, skin cells, and other tissues throughout the body.",False,"['inside the cell nucleus', 'chromosomes in a cell', 'in organelles , such as mitochondria or chloroplasts']"
332,"The phrase ""let them eat cake"" is commonly attributed to Marie Antoinette, although there is no definitive evidence that she actually said it. The phrase is often used to illustrate her perceived indifference to the plight of the poor during the French Revolution.",False,['Jean - Jacques Rousseau']
333,The pulmonary trunk receives blood from the right ventricle of the heart. It carries deoxygenated blood away from the heart to the lungs for oxygenation.,True,"['the heart', 'from the heart', 'the right ventricle', 'the right side of the heart']"
334,"The passages provided all relate to where the butchers in the slaughterhouse cases lived, but they do not contain specific information. Therefore, I cannot provide a definitive answer regarding the location of the butchers in the slaughterhouse cases based on the information given. If you have more specific details or context from the passages, I would be happy to help further!",False,['New Orleans']
335,"The International Monetary Fund (IMF) has several key roles, which typically include:

1. **Surveillance**: The IMF monitors the economic and financial developments of its member countries and provides policy advice to promote stability and growth.

2. **Financial Assistance**: The IMF provides financial support to countries facing balance of payments problems, helping them stabilize their economies.

3. **Capacity Development**: The IMF offers technical assistance and training to help countries improve their economic management and strengthen their institutions.

4. **Research and Data**: The IMF conducts research on global economic issues and provides data and analysis to help member countries make informed policy decisions.

5. **Global Cooperation**: The IMF fosters international monetary cooperation and provides a forum for dialogue among its member countries on economic and financial issues.

These roles are aimed at promoting global economic stability and growth, reducing poverty, and facilitating international trade.",False,"['to foster global monetary cooperation', 'secure financial stability', 'facilitate international trade', 'reduce poverty around the world', 'foster global monetary cooperation', 'promote high employment and sustainable economic growth']"
336,"The revolution period of Venus is approximately 225 Earth days. In terms of Earth years, this is about 0.615 Earth years.",False,"['224.7 Earth days', '0.615 198 yr']"
337,"The passages indicate that they all relate to who plays Auggie in the movie ""The Wonder,"" but they do not provide specific information. However, based on external knowledge, Auggie in the movie ""The Wonder"" is played by Jacob Tremblay.",True,['Jacob Tremblay']
338,"The passages provided all relate to the same topic, which is when the celebrities entered the Big Brother house. However, since the specific dates or details are not included in the passages, I cannot provide an exact answer to your question. If you have more specific information or context from the passages, please share it, and I would be happy to help!",False,"['2017', 'February 7 , 2018']"
339,"The passages provided do not contain specific information about who the Chiefs played in the playoffs. Therefore, I cannot answer the question based on the given passages. If you have more detailed information or specific teams mentioned, please provide that for a more accurate response.",False,['the Tennessee Titans']
340,"The first step in the evolution of the eye is typically thought to be the development of simple light-sensitive cells. These cells allowed organisms to detect light and dark, which provided a significant survival advantage by helping them navigate their environment. Over time, these simple structures evolved into more complex forms, leading to the diverse range of eyes seen in the animal kingdom today.",False,"['photoreceptor proteins that sense light', 'eyespots', ""photoreceptor proteins that sense light , found even in unicellular organisms , called `` eyespots ''""]"
341,"One of the main goals of the Democratic Party is to promote social justice and equality. This includes advocating for policies that support civil rights, healthcare access, education, and economic opportunities for all individuals, particularly marginalized communities.",False,"['economic equality', 'social and economic equality', 'social and economic equality , along with the welfare state']"
342,"Based on the provided passages, it appears that they all relate to a drug that might be used in surgery for its amnesic properties. However, the specific name of the drug is not mentioned in the excerpts you provided. Common drugs known for their amnesic properties and used in surgical settings include benzodiazepines (like midazolam) and certain anesthetics (like propofol). If you are looking for a specific drug name, please provide more context or details from the passages.",True,"['Benzodiazepines', 'benzodiazepines']"
343,"""Somewhere Over the Rainbow"" was first introduced in the 1939 film ""The Wizard of Oz.""",True,['1939']
344,"The passages provided do not contain specific information about the winners of the men's singles title in the Australian Open tennis tournament. Therefore, I cannot provide an answer based on the given passages. If you have specific names or years in mind, please provide that information for a more accurate response.",False,['Roger Federer']
345,"Low voltage transformers are commonly used in various applications. Here are two examples:

1. **Residential Lighting Systems**: Low voltage transformers are often used to step down the voltage for outdoor and indoor lighting systems, such as landscape lighting or low-voltage LED fixtures, ensuring safety and energy efficiency.

2. **Power Supply for Electronic Devices**: These transformers are also utilized in power adapters for electronic devices, such as chargers for laptops and smartphones, converting standard mains voltage to a lower voltage suitable for the device's operation.",False,"['toys', 'doorbell installations']"
346,"Based on the passages provided, it appears that they all relate to the same topic: who has the most wins on ""Around the Horn."" However, since the specific details from the passages are not included, I cannot provide the name of the individual with the most wins. If you have that information or specific details from the passages, please share, and I can help you further!",False,['Woody Paige']
347,"The Berlin Wall went up in East Germany on August 13, 1961.",False,"[') , starting on', 'East Germany ) , starting on']"
348,"To determine when an individual or household is considered under the poverty line, various factors are typically taken into account, including income level, family size, and the cost of living in a specific area. Generally, if a person's or household's income falls below a certain threshold established by government guidelines, they are classified as living in poverty. This threshold can vary based on geographic location and is often updated annually to reflect changes in the economy and inflation. 

For specific details, it would be necessary to refer to the guidelines provided by relevant governmental or social organizations that define the poverty line for a given year and region.",False,"['US $11,770']"
349,"It seems that you are asking about the Jawaharlal Nehru Centre for Advanced Scientific Research (JNCASR) located at the Jakkur campus. However, the passages provided do not contain specific information or details about the center. If you have a particular question or need information about JNCASR, please provide more context or specify what you would like to know!",False,"['Jakkur , Bangalore , India']"
350,"The middle sister on ""Full House"" was played by Jodie Sweetin.",True,['Jodie Sweetin']
351,"Based on the passages provided, it appears that they all relate to the same topic: the world's largest company in terms of revenue. However, the specific name of the company is not mentioned in the passages. As of my last knowledge update in October 2023, Walmart was often cited as the world's largest company by revenue. Please verify with the most current sources for any updates or changes.",True,['Walmart']
352,"The song ""You'll Never Find Another Love Like Mine"" is sung by Lou Rawls.",True,['Lou Rawls']
353,"The passages you provided all relate to the same topic, but they do not contain specific information. However, based on general knowledge, the guy who famously jumped from space is Felix Baumgartner. He made a record-breaking jump from the stratosphere on October 14, 2012, during the Red Bull Stratos project.",True,['Felix Baumgartner']
354,The branch of science that deals with the structure of human body parts is called **anatomy**.,True,"['Anatomy', 'Human anatomy', 'human anatomy']"
355,Muhammad Ali won an Olympic gold medal in boxing at the 1960 Rome Olympics.,True,"['1960', 'at the 1960 Summer Olympics in Rome']"
356,"The passages you provided all describe a bond that the issuer has the right to pay off before its maturity date. This type of bond is commonly referred to as a ""callable bond."" Callable bonds allow the issuer to redeem the bond at a specified price before the maturity date, which can be advantageous for the issuer if interest rates decrease or if they want to refinance the debt.",True,"['callable', 'callable bonds']"
357,"Based on the provided passages, the group Bacteroids would likely be found in environments such as the human gut, where they play a significant role in digestion and maintaining gut health. They are also commonly found in soil and marine environments, contributing to the breakdown of organic matter. If you need more specific information or details from the passages, please provide the text of those passages for a more accurate response.",False,"['human colon', 'the human colon']"
358,"The iconic animated short educational film ""Ek Anek Aur Ekta"" was directed by B. R. Chopra.",False,['Vijaya Mulay']
359,"The Winter Olympics are held in various locations around the world, with each edition taking place in a different city. The specific location and start date can vary depending on the year. For the most recent Winter Olympics, they were held in Beijing, China, from February 4 to February 20, 2022. For future events, the next Winter Olympics are scheduled to take place in Milan and Cortina d'Ampezzo, Italy, in 2026. The exact start date for those games is February 6, 2026.",False,"['9 February', 'Pyeongchang , South Korea', 'Pyeongchang County , South Korea', 'from 9 to 25 February 2018 in Pyeongchang County , South Korea', '9 to 25 February 2018']"
360,"There are four levels of protein structure: primary, secondary, tertiary, and quaternary.",True,['four']
361,The Cat and Mouse Act was introduced in 1913.,True,['1913']
362,"The emblematic rhythm of the Dominican Republic is Merengue. This lively and energetic genre is deeply rooted in the country's culture and is characterized by its fast-paced tempo and distinctive dance style. Merengue is often associated with celebrations and social gatherings, making it a vital part of Dominican identity and heritage.",True,"['merengue', 'bachata']"
363,"The first NHL hockey game was played in Montreal, Quebec, Canada.",True,"['Montreal', 'Ottawa']"
364,The first European ship to sail around the tip of Africa was captained by Bartolomeu Dias.,True,['Bartolomeu Dias']
365,"In an autocracy, important government decisions are typically made by a single individual or a small group of individuals who hold significant power and authority. This centralization of decision-making means that the general populace has little to no influence over these decisions, as they are often dictated by the autocrat or ruling elite.",False,['one person']
366,"The voice of Marceline on ""Adventure Time"" is provided by Olivia Olson.",True,"['Olivia Olson', 'Ava Acres', 'Cloris Leachman', 'Olivia Olson in most appearances', 'Ava Acres as a child', 'voiced by Olivia Olson in most appearances , by Ava Acres as a child and by Cloris Leachman as an old woman', 'Cloris Leachman as an old woman']"
367,"The passages you provided all relate to the information displayed in clear text from the FTP (File Transfer Protocol) header. While the specific details of each passage are not included, generally, the information displayed in clear text from the FTP header typically includes:

1. **FTP Commands**: Commands such as USER, PASS, LIST, RETR, STOR, etc.
2. **Response Codes**: Numeric codes indicating the status of the command (e.g., 200 for success, 404 for not found).
3. **Server Messages**: Textual messages from the server providing information about the status of the connection or the result of commands.
4. **Connection Information**: Details about the connection, such as the IP address and port number.
5. **File Information**: Metadata about files being transferred, such as file size, modification date, and permissions.

If you need more specific information or details from the passages, please provide the text of those passages for a more tailored response.",False,['all transmissions']
368,"Based on the passages provided, the most important new religious figure of the New Kingdom of ancient Egypt is likely to be Akhenaten. He is known for introducing a form of monotheism centered around the worship of the sun disk, Aten, which marked a significant shift in religious practices during that period.",True,"['Aten', 'the Aten , a representation of the Egyptian god , Ra']"
369,"In aerobic respiration, a total of 6 carbon dioxide (CO2) molecules are produced from one molecule of glucose. This occurs through the processes of glycolysis, the citric acid cycle (Krebs cycle), and oxidative phosphorylation.",True,['6']
370,"The passages you provided do not contain specific information about the theater number related to the Aurora shooting. If you have access to the content of those passages, please share the relevant details, and I can help you determine the theater number.",False,"['9', 'Theater 9', 'in Theater 9 at the Century 16 multiplex']"
371,"Former presidents of the United States are entitled to Secret Service protection for life. However, this was not always the case; prior to 1994, former presidents received protection for only 10 years after leaving office. In 2013, legislation was enacted that restored lifetime protection for all former presidents, including those who served before the law was changed.",True,"['lifetime', 'lifetime protection']"
372,"Before the arrival of Islam, the predominant religion in Persia (modern-day Iran) was Zoroastrianism. This ancient faith, founded by the prophet Zoroaster (or Zarathustra), emphasized the worship of Ahura Mazda, the supreme god, and focused on the concepts of truth, order, and the struggle between good and evil. Zoroastrianism played a significant role in shaping the cultural and spiritual landscape of Persia prior to the Islamic conquest in the 7th century.",True,"['the Zoroastrian religion', 'Zoroastrian']"
373,"In ""The Flash,"" Barry Allen's mother, Nora Allen, is killed by the Reverse-Flash, also known as Eobard Thawne.",True,"['Professor Eobard Thawne', 'Thawne']"
374,"The NBA officially allowed zone defense starting in the 2001-2002 season. Prior to that, teams were primarily required to play man-to-man defense. The introduction of zone defense changed the dynamics of the game, allowing for more strategic defensive plays.",True,"['2002', 'the 2001 -- 2002 season']"
375,"The passages you provided all relate to the release date of ""Isle of Dogs"" in the U.S. However, since the specific release date is not included in your message, I cannot provide that information. If you have access to the passages, please check them for the exact release date. Alternatively, I can tell you that ""Isle of Dogs"" was released in the U.S. on March 23, 2018.",False,"['March 23 , 2018', 'April 13 , 2018']"
376,Brent Barry won the dunk contest in 1996.,True,['1996']
377,"The captain of the Mayflower, which brought the Pilgrims to Plymouth, was Christopher Jones.",True,"['Christopher Jones', 'Master Christopher Jones']"
